{
  "schema_version": "spotinfo.recommend/v3",
  "status": "ok",
  "request": {
    "cloud": "aws",
    "regions": [
      "all"
    ],
    "machine": "",
    "architecture": "x86_64",
    "os": "linux",
    "min_vcpu": 2,
    "min_memory_gib": 8,
    "max_price": null,
    "workload": "cost",
    "top": 3
  },
  "ranking_policy": [
    "spot_price_ascending",
    "excess_vcpu_ascending",
    "excess_memory_gib_ascending",
    "region_ascending",
    "machine_ascending"
  ],
  "data_source": {
    "provider": "aws",
    "mode": "embedded-snapshot",
    "sources": [
      {
        "url": "https://spot-bid-advisor.s3.amazonaws.com/spot-advisor-data.json",
        "fetched_at": "2026-08-06T08:58:27Z",
        "observed_at": null,
        "content_sha256": "f42df66cd52c9dc3ac28b6bb7e525627696eec60692d5cf56658c679f0012393",
        "parser_version": "aws-spot-advisor-json/1",
        "schema_version": "aws.spot-advisor-feed/v1"
      },
      {
        "url": "https://website.spot.ec2.aws.a2z.com/spot.json",
        "fetched_at": "2026-08-06T08:58:27Z",
        "observed_at": null,
        "content_sha256": "9d5a4d0b1a4a1f9e1f6f8f0b0d3a4c5e6f7a8b9c0d1e2f3a4b5c6d7e8f9a0b1c",
        "parser_version": "aws-spot-price-json/1",
        "schema_version": "aws.spot-price-feed/v1"
      }
    ],
    "sources_omitted": 0
  },
  "recommendations": [
    {
      "rank": 1,
      "cloud": "aws",
      "region": "us-east-1",
      "machine": "m5.large",
      "architecture": "x86_64",
      "os": "linux",
      "vcpu": 2,
      "memory_gib": 8,
      "spot_usd_per_hour": "0.035000000",
      "on_demand_usd_per_hour": null,
      "savings_percent": 68,
      "risk": {
        "status": "available",
        "kind": "interruption_bucket",
        "label": "\u003c5%",
        "min_percent": 0,
        "max_percent": 5,
        "window_days": 30,
        "source_url": "https://spot-bid-advisor.s3.amazonaws.com/spot-advisor-data.json",
        "observed_at": null
      },
      "rationale_codes": [
        "ARCHITECTURE_MATCH",
        "COST_POLICY",
        "KNOWN_POSITIVE_PRICE",
        "RESOURCE_MINIMUMS_MET"
      ]
    },
    {
      "rank": 2,
      "cloud": "aws",
      "region": "us-east-1",
      "machine": "m6i.large",
      "architecture": "x86_64",
      "os": "linux",
      "vcpu": 2,
      "memory_gib": 8,
      "spot_usd_per_hour": "0.041600000",
      "on_demand_usd_per_hour": null,
      "savings_percent": 72,
      "risk": {
        "status": "available",
        "kind": "interruption_bucket",
        "label": "\u003c5%",
        "min_percent": 0,
        "max_percent": 5,
        "window_days": 30,
        "source_url": "https://spot-bid-advisor.s3.amazonaws.com/spot-advisor-data.json",
        "observed_at": null
      },
      "rationale_codes": [
        "ARCHITECTURE_MATCH",
        "COST_POLICY",
        "KNOWN_POSITIVE_PRICE",
        "RESOURCE_MINIMUMS_MET"
      ]
    },
    {
      "rank": 3,
      "cloud": "aws",
      "region": "us-west-2",
      "machine": "m5.xlarge",
      "architecture": "x86_64",
      "os": "linux",
      "vcpu": 4,
      "memory_gib": 16,
      "spot_usd_per_hour": "0.123400000",
      "on_demand_usd_per_hour": null,
      "savings_percent": 65,
      "risk": {
        "status": "available",
        "kind": "interruption_bucket",
        "label": "5-10%",
        "min_percent": 5,
        "max_percent": 11,
        "window_days": 30,
        "source_url": "https://spot-bid-advisor.s3.amazonaws.com/spot-advisor-data.json",
        "observed_at": null
      },
      "rationale_codes": [
        "ARCHITECTURE_MATCH",
        "COST_POLICY",
        "KNOWN_POSITIVE_PRICE",
        "RESOURCE_MINIMUMS_MET"
      ]
    }
  ],
  "warnings": []
}
